{
  "categories": [
    {
      "count": 100,
      "key": "fixture",
      "label": "Fixture"
    }
  ],
  "entries": [
    {
      "availableActions": [
        "recognised",
        "review",
        "open"
      ],
      "category": {
        "key": "fixture",
        "label": "Fixture"
      },
      "contextualMeaning": "Synthetic fixture only.",
      "difficulty": 1,
      "familyId": "expression2:00000000-0000-7000-8000-000000000001",
      "formCount": 1,
      "intentions": [
        "Exercise runtime indexing."
      ],
      "japanese": "テスト表現",
      "pack": "family-pack-01",
      "reading": "てすとひょうげん",
      "searchText": "テスト表現 てすとひょうげん synthetic fixture contract validation",
      "slug": "synthetic-fixture-001",
      "usageContexts": [
        "Contract validation only"
      ],
      "verifiedSourceState": "verified"
    },
    {
      "availableActions": [
        "recognised",
        "review",
        "open"
      ],
      "category": {
        "key": "fixture",
        "label": "Fixture"
      },
      "contextualMeaning": "Synthetic fixture only.",
      "difficulty": 2,
      "familyId": "expression2:00000000-0000-7000-8000-000000000002",
      "formCount": 1,
      "intentions": [
        "Exercise runtime indexing."
      ],
      "japanese": "テスト表現",
      "pack": "family-pack-01",
      "reading": "てすとひょうげん",
      "searchText": "テスト表現 てすとひょうげん synthetic fixture contract validation",
      "slug": "synthetic-fixture-002",
      "usageContexts": [
        "Contract validation only"
      ],
      "verifiedSourceState": "verified"
    },
    {
      "availableActions": [
        "recognised",
        "review",
        "open"
      ],
      "category": {
        "key": "fixture",
        "label": "Fixture"
      },
      "contextualMeaning": "Synthetic fixture only.",
      "difficulty": 3,
      "familyId": "expression2:00000000-0000-7000-8000-000000000003",
      "formCount": 1,
      "intentions": [
        "Exercise runtime indexing."
      ],
      "japanese": "テスト表現",
      "pack": "family-pack-01",
      "reading": "てすとひょうげん",
      "searchText": "テスト表現 てすとひょうげん synthetic fixture contract validation",
      "slug": "synthetic-fixture-003",
      "usageContexts": [
        "Contract validation only"
      ],
      "verifiedSourceState": "verified"
    },
    {
      "availableActions": [
        "recognised",
        "review",
        "open"
      ],
      "category": {
        "key": "fixture",
        "label": "Fixture"
      },
      "contextualMeaning": "Synthetic fixture only.",
      "difficulty": 4,
      "familyId": "expression2:00000000-0000-7000-8000-000000000004",
      "formCount": 1,
      "intentions": [
        "Exercise runtime indexing."
      ],
      "japanese": "テスト表現",
      "pack": "family-pack-01",
      "reading": "てすとひょうげん",
      "searchText": "テスト表現 てすとひょうげん synthetic fixture contract validation",
      "slug": "synthetic-fixture-004",
      "usageContexts": [
        "Contract validation only"
      ],
      "verifiedSourceState": "verified"
    },
    {
      "availableActions": [
        "recognised",
        "review",
        "open"
      ],
      "category": {
        "key": "fixture",
        "label": "Fixture"
      },
      "contextualMeaning": "Synthetic fixture only.",
      "difficulty": 5,
      "familyId": "expression2:00000000-0000-7000-8000-000000000005",
      "formCount": 1,
      "intentions": [
        "Exercise runtime indexing."
      ],
      "japanese": "テスト表現",
      "pack": "family-pack-01",
      "reading": "てすとひょうげん",
      "searchText": "テスト表現 てすとひょうげん synthetic fixture contract validation",
      "slug": "synthetic-fixture-005",
      "usageContexts": [
        "Contract validation only"
      ],
      "verifiedSourceState": "verified"
    },
    {
      "availableActions": [
        "recognised",
        "review",
        "open"
      ],
      "category": {
        "key": "fixture",
        "label": "Fixture"
      },
      "contextualMeaning": "Synthetic fixture only.",
      "difficulty": 1,
      "familyId": "expression2:00000000-0000-7000-8000-000000000006",
      "formCount": 1,
      "intentions": [
        "Exercise runtime indexing."
      ],
      "japanese": "テスト表現",
      "pack": "family-pack-01",
      "reading": "てすとひょうげん",
      "searchText": "テスト表現 てすとひょうげん synthetic fixture contract validation",
      "slug": "synthetic-fixture-006",
      "usageContexts": [
        "Contract validation only"
      ],
      "verifiedSourceState": "verified"
    },
    {
      "availableActions": [
        "recognised",
        "review",
        "open"
      ],
      "category": {
        "key": "fixture",
        "label": "Fixture"
      },
      "contextualMeaning": "Synthetic fixture only.",
      "difficulty": 2,
      "familyId": "expression2:00000000-0000-7000-8000-000000000007",
      "formCount": 1,
      "intentions": [
        "Exercise runtime indexing."
      ],
      "japanese": "テスト表現",
      "pack": "family-pack-01",
      "reading": "てすとひょうげん",
      "searchText": "テスト表現 てすとひょうげん synthetic fixture contract validation",
      "slug": "synthetic-fixture-007",
      "usageContexts": [
        "Contract validation only"
      ],
      "verifiedSourceState": "verified"
    },
    {
      "availableActions": [
        "recognised",
        "review",
        "open"
      ],
      "category": {
        "key": "fixture",
        "label": "Fixture"
      },
      "contextualMeaning": "Synthetic fixture only.",
      "difficulty": 3,
      "familyId": "expression2:00000000-0000-7000-8000-000000000008",
      "formCount": 1,
      "intentions": [
        "Exercise runtime indexing."
      ],
      "japanese": "テスト表現",
      "pack": "family-pack-01",
      "reading": "てすとひょうげん",
      "searchText": "テスト表現 てすとひょうげん synthetic fixture contract validation",
      "slug": "synthetic-fixture-008",
      "usageContexts": [
        "Contract validation only"
      ],
      "verifiedSourceState": "verified"
    },
    {
      "availableActions": [
        "recognised",
        "review",
        "open"
      ],
      "category": {
        "key": "fixture",
        "label": "Fixture"
      },
      "contextualMeaning": "Synthetic fixture only.",
      "difficulty": 4,
      "familyId": "expression2:00000000-0000-7000-8000-000000000009",
      "formCount": 1,
      "intentions": [
        "Exercise runtime indexing."
      ],
      "japanese": "テスト表現",
      "pack": "family-pack-01",
      "reading": "てすとひょうげん",
      "searchText": "テスト表現 てすとひょうげん synthetic fixture contract validation",
      "slug": "synthetic-fixture-009",
      "usageContexts": [
        "Contract validation only"
      ],
      "verifiedSourceState": "verified"
    },
    {
      "availableActions": [
        "recognised",
        "review",
        "open"
      ],
      "category": {
        "key": "fixture",
        "label": "Fixture"
      },
      "contextualMeaning": "Synthetic fixture only.",
      "difficulty": 5,
      "familyId": "expression2:00000000-0000-7000-8000-00000000000a",
      "formCount": 1,
      "intentions": [
        "Exercise runtime indexing."
      ],
      "japanese": "テスト表現",
      "pack": "family-pack-01",
      "reading": "てすとひょうげん",
      "searchText": "テスト表現 てすとひょうげん synthetic fixture contract validation",
      "slug": "synthetic-fixture-010",
      "usageContexts": [
        "Contract validation only"
      ],
      "verifiedSourceState": "verified"
    },
    {
      "availableActions": [
        "recognised",
        "review",
        "open"
      ],
      "category": {
        "key": "fixture",
        "label": "Fixture"
      },
      "contextualMeaning": "Synthetic fixture only.",
      "difficulty": 1,
      "familyId": "expression2:00000000-0000-7000-8000-00000000000b",
      "formCount": 1,
      "intentions": [
        "Exercise runtime indexing."
      ],
      "japanese": "テスト表現",
      "pack": "family-pack-01",
      "reading": "てすとひょうげん",
      "searchText": "テスト表現 てすとひょうげん synthetic fixture contract validation",
      "slug": "synthetic-fixture-011",
      "usageContexts": [
        "Contract validation only"
      ],
      "verifiedSourceState": "verified"
    },
    {
      "availableActions": [
        "recognised",
        "review",
        "open"
      ],
      "category": {
        "key": "fixture",
        "label": "Fixture"
      },
      "contextualMeaning": "Synthetic fixture only.",
      "difficulty": 2,
      "familyId": "expression2:00000000-0000-7000-8000-00000000000c",
      "formCount": 1,
      "intentions": [
        "Exercise runtime indexing."
      ],
      "japanese": "テスト表現",
      "pack": "family-pack-01",
      "reading": "てすとひょうげん",
      "searchText": "テスト表現 てすとひょうげん synthetic fixture contract validation",
      "slug": "synthetic-fixture-012",
      "usageContexts": [
        "Contract validation only"
      ],
      "verifiedSourceState": "verified"
    },
    {
      "availableActions": [
        "recognised",
        "review",
        "open"
      ],
      "category": {
        "key": "fixture",
        "label": "Fixture"
      },
      "contextualMeaning": "Synthetic fixture only.",
      "difficulty": 3,
      "familyId": "expression2:00000000-0000-7000-8000-00000000000d",
      "formCount": 1,
      "intentions": [
        "Exercise runtime indexing."
      ],
      "japanese": "テスト表現",
      "pack": "family-pack-01",
      "reading": "てすとひょうげん",
      "searchText": "テスト表現 てすとひょうげん synthetic fixture contract validation",
      "slug": "synthetic-fixture-013",
      "usageContexts": [
        "Contract validation only"
      ],
      "verifiedSourceState": "verified"
    },
    {
      "availableActions": [
        "recognised",
        "review",
        "open"
      ],
      "category": {
        "key": "fixture",
        "label": "Fixture"
      },
      "contextualMeaning": "Synthetic fixture only.",
      "difficulty": 4,